{
  "name": "youtube-1080p",
  "label": "YouTube 1080p",
  "description": "For uploading: H.264 up to 1080p at the sequence's rate, AAC 320 kb/s, MP4.",
  "category": "youtube",
  "container": "mp4",
  "extension": ".mp4",
  "video": {
    "codec": "h264",
    "encoders": ["h264_nvenc", "libx264"],
    "maxHeight": 1080,
    "quality": 19,
    "speed": "medium"
  },
  "audio": { "encoder": "aac", "bitrate": 320000 }
}
